{
  "schemaVersion": "1.0.0",
  "cultivarId": "CUL-000019",
  "publicationClass": "catalogue-profile",
  "status": "approved",
  "assets": [
    {
      "id": "MED-CUL-000019-001",
      "cultivarId": "CUL-000019",
      "mediaType": "photograph",
      "role": "habit-primary",
      "isPrimary": true,
      "status": "approved",
      "assetPath": "/media/derivatives/catalogue/cul-000019/med-cul-000019-001-display.jpg",
      "thumbnailPath": "/media/derivatives/catalogue/cul-000019/med-cul-000019-001-thumb.jpg",
      "altText": "Source-identified ‘Shin Deshojo’ Japanese maple photographed during its red spring flush at Meise Botanic Garden.",
      "caption": "Spring view of the source-identified ‘Shin Deshojo’ specimen at Meise Botanic Garden in April 2024.",
      "creator": "Michael Wolf",
      "rightsHolder": "Michael Wolf",
      "rightsBasis": "creative-commons",
      "licence": "CC BY-SA 3.0",
      "licenceUrl": "https://creativecommons.org/licenses/by-sa/3.0/",
      "sourceUrl": "https://commons.wikimedia.org/wiki/File:Acer%20palmatum%20Shin%20Deshojo%20BG%20Meise%2037972.JPG",
      "sourceItemId": "Wikimedia Commons Acer palmatum Shin Deshojo BG Meise 37972.JPG",
      "attributionText": "Michael Wolf, Penig, CC BY-SA 3.0, via Wikimedia Commons.",
      "source": {
        "path": "/atlas-repository/media-sources/catalogue/CUL-000019/MED-CUL-000019-001-source.jpg",
        "sha256": "4f5ceef8eec7df35c1eee260170f5e288ff37ca586f75c13b6e3c93581dd8ec7",
        "preservation": "Exact original JPEG bytes downloaded from Wikimedia Commons and retained without modification."
      },
      "identity": {
        "confidence": "source-asserted",
        "identificationBasis": "The photographer identifies the specimen as Acer palmatum ‘Shin Deshojo’ in Meise Botanic Garden, Belgium.",
        "limitations": "No accession mapping or propagation record was recovered; the source spelling is retained and red spring colour alone is not diagnostic.",
        "publicQualification": "Source-identified at Meise Botanic Garden; not independently authenticated by the Japanese Maple Atlas."
      },
      "privacy": {
        "status": "location-generalised",
        "exifRetained": false,
        "gpsRetained": false,
        "locationGranularity": "Meise Botanic Garden, Belgium"
      },
      "derivatives": [
        {
          "profile": "thumb",
          "path": "/media/derivatives/catalogue/cul-000019/med-cul-000019-001-thumb.jpg",
          "width": 281,
          "height": 231,
          "mimeType": "image/jpeg",
          "sha256": "e70cd23205c11eeb88928e3f45d455afb4fd5e0945a3b3fb21cffe4a95dde9ba",
          "derivedFrom": "MED-CUL-000019-001"
        },
        {
          "profile": "card",
          "path": "/media/derivatives/catalogue/cul-000019/med-cul-000019-001-card.jpg",
          "width": 491,
          "height": 404,
          "mimeType": "image/jpeg",
          "sha256": "44544bb306a8a85f4bd4027d8ca4b1335f271fa632c9d2a1e008d5546258ad36",
          "derivedFrom": "MED-CUL-000019-001"
        },
        {
          "profile": "display",
          "path": "/media/derivatives/catalogue/cul-000019/med-cul-000019-001-display.jpg",
          "width": 843,
          "height": 693,
          "mimeType": "image/jpeg",
          "sha256": "e8fc81295aa972aaa9b3f2b8ce868147e9a014b9b044f59cdf7911f27a1dfd32",
          "derivedFrom": "MED-CUL-000019-001"
        },
        {
          "profile": "archive",
          "path": "/media/derivatives/catalogue/cul-000019/med-cul-000019-001-archive.jpg",
          "width": 1266,
          "height": 1040,
          "mimeType": "image/jpeg",
          "sha256": "6da51db195d66555598506a943944f22ed1c18864018b16becd9712782ddfc77",
          "derivedFrom": "MED-CUL-000019-001"
        }
      ],
      "approvalHistory": [
        {
          "status": "approved",
          "date": "2026-07-29",
          "authority": "Japanese Maple Atlas media / visual-assets stream",
          "note": "Exact source rights, creator attribution, source-asserted identity qualification, privacy treatment, visual role and deterministic derivatives reviewed under the Visual-First Catalogue contract."
        }
      ]
    },
    {
      "id": "MED-CUL-000019-002",
      "cultivarId": "CUL-000019",
      "mediaType": "photograph",
      "role": "foliage-detail",
      "isPrimary": false,
      "status": "approved",
      "assetPath": "/media/derivatives/catalogue/cul-000019/med-cul-000019-002-display.jpg",
      "thumbnailPath": "/media/derivatives/catalogue/cul-000019/med-cul-000019-002-thumb.jpg",
      "altText": "Attached red spring leaves on the source-identified ‘Shin Deshojo’ specimen at Meise Botanic Garden.",
      "caption": "Attached spring foliage on the source-identified ‘Shin Deshojo’ specimen at Meise Botanic Garden.",
      "creator": "Michael Wolf",
      "rightsHolder": "Michael Wolf",
      "rightsBasis": "creative-commons",
      "licence": "CC BY-SA 3.0",
      "licenceUrl": "https://creativecommons.org/licenses/by-sa/3.0/",
      "sourceUrl": "https://commons.wikimedia.org/wiki/File:Acer%20palmatum%20Shin%20Deshojo%20BG%20Meise%2037973.JPG",
      "sourceItemId": "Wikimedia Commons Acer palmatum Shin Deshojo BG Meise 37973.JPG",
      "attributionText": "Michael Wolf, Penig, CC BY-SA 3.0, via Wikimedia Commons.",
      "source": {
        "path": "/atlas-repository/media-sources/catalogue/CUL-000019/MED-CUL-000019-002-source.jpg",
        "sha256": "f8ded1591a612b5974888f357f452ff18fe9055fc9fae2073c182c242cd7aa60",
        "preservation": "Exact original JPEG bytes downloaded from Wikimedia Commons and retained without modification."
      },
      "identity": {
        "confidence": "source-asserted",
        "identificationBasis": "The photographer identifies the specimen as Acer palmatum ‘Shin Deshojo’ in Meise Botanic Garden, Belgium.",
        "limitations": "No accession mapping or propagation record was recovered; similar spring-red cultivars may be difficult to distinguish from foliage alone.",
        "publicQualification": "Source-identified at Meise Botanic Garden; not independently authenticated by the Japanese Maple Atlas."
      },
      "privacy": {
        "status": "location-generalised",
        "exifRetained": false,
        "gpsRetained": false,
        "locationGranularity": "Meise Botanic Garden, Belgium"
      },
      "derivatives": [
        {
          "profile": "thumb",
          "path": "/media/derivatives/catalogue/cul-000019/med-cul-000019-002-thumb.jpg",
          "width": 173,
          "height": 231,
          "mimeType": "image/jpeg",
          "sha256": "0f2652cf5761797188b51b22cd7ed0ee650fe0e67f4247d1c57cd275cc59d43c",
          "derivedFrom": "MED-CUL-000019-002"
        },
        {
          "profile": "card",
          "path": "/media/derivatives/catalogue/cul-000019/med-cul-000019-002-card.jpg",
          "width": 303,
          "height": 404,
          "mimeType": "image/jpeg",
          "sha256": "293c91a04c6844e51c9c73361960ad57379188e02cf5289d767abae69a727ddf",
          "derivedFrom": "MED-CUL-000019-002"
        },
        {
          "profile": "display",
          "path": "/media/derivatives/catalogue/cul-000019/med-cul-000019-002-display.jpg",
          "width": 519,
          "height": 693,
          "mimeType": "image/jpeg",
          "sha256": "ae1dba20947ce71938a2f04de03dbea297aa9fd9de2298b8476b9ff96659fc55",
          "derivedFrom": "MED-CUL-000019-002"
        },
        {
          "profile": "archive",
          "path": "/media/derivatives/catalogue/cul-000019/med-cul-000019-002-archive.jpg",
          "width": 780,
          "height": 1040,
          "mimeType": "image/jpeg",
          "sha256": "16fa8ad58ae9138689f3c1c54f2878d4872ee61fbfc9bd719190fae5f4b756ff",
          "derivedFrom": "MED-CUL-000019-002"
        }
      ],
      "approvalHistory": [
        {
          "status": "approved",
          "date": "2026-07-29",
          "authority": "Japanese Maple Atlas media / visual-assets stream",
          "note": "Exact source rights, creator attribution, source-asserted identity qualification, privacy treatment, visual role and deterministic derivatives reviewed under the Visual-First Catalogue contract."
        }
      ]
    },
    {
      "id": "MED-CUL-000019-003",
      "cultivarId": "CUL-000019",
      "mediaType": "photograph",
      "role": "seasonal-diagnostic",
      "isPrimary": false,
      "status": "approved",
      "assetPath": "/media/derivatives/catalogue/cul-000019/med-cul-000019-003-display.jpg",
      "thumbnailPath": "/media/derivatives/catalogue/cul-000019/med-cul-000019-003-thumb.jpg",
      "altText": "Labelled ‘Shindeshojo’ Japanese maple bonsai showing a greener midsummer canopy at the 2008 Tatton Park Flower Show.",
      "caption": "Separate source-identified ‘Shindeshojo’ bonsai photographed in late July 2008, used only to illustrate a greener summer expression alongside the Meise spring-flush images.",
      "creator": "Mike Peel",
      "rightsHolder": "Mike Peel",
      "rightsBasis": "creative-commons",
      "licence": "CC BY-SA 4.0",
      "licenceUrl": "https://creativecommons.org/licenses/by-sa/4.0/",
      "sourceUrl": "https://commons.wikimedia.org/wiki/File:Acer%20Palmatum%20bonsai.jpg",
      "sourceItemId": "Wikimedia Commons Acer Palmatum bonsai.jpg",
      "attributionText": "Photograph by Mike Peel, CC BY-SA 4.0, via Wikimedia Commons.",
      "source": {
        "path": "/atlas-repository/media-sources/catalogue/CUL-000019/MED-CUL-000019-003-source.jpg",
        "sha256": "fc36de4513cd8ff34a9972c7aed778ab8318d7538fdc61bad7e3ffe5d9cb1612",
        "preservation": "Exact original JPEG bytes downloaded from Wikimedia Commons and retained without modification."
      },
      "identity": {
        "confidence": "source-asserted",